{
  "type": "session.start",
  "session_id": "vs_7Hq2Lm9xQa",
  "call_id": "call_01JBX6Y3R0QK5D8M2T4W6Z9C1E",
  "agent_id": "agent_01JBX6Y3NHZ9V3K7T2Q5R8M4PA",
  "direction": "outbound",
  "from": {
    "kind": "number",
    "value": "+14155550199"
  },
  "to": {
    "kind": "number",
    "value": "+14155550100"
  },
  "session_type": "audio",
  "started_at": "2026-10-23T12:00:00Z",
  "audio": {
    "stream": 1,
    "sample_rate": 16000
  },
  "context": {
    "order_id": "A-1042"
  },
  "max_duration_ms": 900000
}
