{
  "type": "session.start",
  "session_id": "vs_7Hq2Lm9xQa",
  "call_id": "call_01JBX6Y3R0QK5D8M2T4W6Z9C1E",
  "agent_id": "agent_01JBX6Y3NHZ9V3K7T2Q5R8M4PA",
  "direction": "inbound",
  "from": {
    "kind": "number",
    "value": "+14155550100"
  },
  "to": {
    "kind": "number",
    "value": "+14155550199"
  },
  "session_type": "text",
  "started_at": "2026-10-23T12:00:00Z",
  "resume": {
    "token": "vsr_9fK2mQ7xLp4ZbT8wNc3RjV6hYd",
    "window_ms": 15000
  }
}
